{
  "schema": 1,
  "app": {
    "name": "getBible.Life",
    "slug": "getbible-life",
    "id": "live.getbible.app",
    "version": "1.0.0",
    "url": "https://app.getbible.life/",
    "homepage_url": "https://app.getbible.life/",
    "allowed_origins": [
      "https://app.getbible.life"
    ],
    "summary": "Read and study the Bible in a focused desktop application",
    "description": "getBible.Life packages the app.getbible.life web application as a focused desktop application for Linux, macOS, and Windows.",
    "about": "getBible.Life is a focused desktop shell for the app.getbible.life Bible reading and study experience.",
    "user_agent_product": "GetBibleLifeDesktop",
    "javascript_object": "GetBibleApp",
    "html_class": "getbible-life-desktop-app"
  },
  "window": {
    "width": 1280,
    "height": 820,
    "minimum_width": 420,
    "minimum_height": 640,
    "show_app_menu": false
  },
  "offline": {
    "title": "Connect to the internet",
    "message": "getBible.Life needs an internet connection. The application will reconnect automatically when the website becomes available.",
    "retry_label": "Try again",
    "checking_message": "Checking the connection…",
    "connected_message": "Connected. Loading getBible.Life…",
    "failed_message": "Still offline. getBible.Life will retry automatically."
  },
  "support": {
    "label": "Get support",
    "url": "https://app.getbible.life/",
    "email": "",
    "message": "Visit app.getbible.life for help and support information."
  },
  "branding": {
    "icon": "branding/getbible-life.png.base64",
    "accent_color": "#76b7e5",
    "background_color": "#111111"
  },
  "linux": {
    "generic_name": "Bible Application",
    "categories": [
      "Education",
      "Utility"
    ],
    "keywords": [
      "Bible",
      "Scripture",
      "Study",
      "GetBible"
    ]
  },
  "snap": {
    "name": "getbible-life",
    "base": "core24",
    "grade": "stable",
    "confinement": "strict",
    "license": "GPL-3.0-or-later"
  },
  "windows": {
    "identity_name": "live.getbible.app",
    "publisher": "CN=Vast Development Method",
    "publisher_display_name": "Vast Development Method",
    "minimum_version": "10.0.17763.0",
    "architecture": "x64"
  },
  "macos": {
    "minimum_system_version": "11.0",
    "category": "public.app-category.reference",
    "copyright": "Copyright © 2026 Vast Development Method"
  }
}
